,Hyponym,Hyperonym,Text,Reference,dec_hyper
43,ГУЛЯШ,ПИЩЕВЫЕ ПРОДУКТЫ,"ПИЩЕВЫЕ ПРОДУКТЫ - То, что едят, чем питаются — любое вещество, пригодное для еды и питья живым организмам для пополнения запасов энергии и необходимых ингредиентов для нормального течения химических реакций обмена веществ: белков, жиров, углеводов, витаминов, минералов и микроэлементов. Питательные вещества попадают в живой организм, где усваиваются клетками с целью выработки и накопления энергии, поддержания жизнедеятельности, а также обеспечения ростовых процессов и созревания. Обычно пища делится по происхождению на растительную и животную.",https://ru.wikipedia.org/wiki/%D0%9F%D0%B8%D1%89%D0%B0,"[['—', 'любое', 'вещество']]"
44,ГУЛЯШ,ПИТАНИЕ,"ПИТАНИЕ - Поддержание жизни и здоровья живого организма с помощью пищи — процесс поглощения пищи живыми организмами для поддержания нормального течения физиологических процессов жизнедеятельности, в частности, для восполнения запаса энергии и реализации процессов роста и развития; составная часть обмена веществ. Животные и другие гетеротрофные организмы должны есть, чтобы выжить; их рацион и процесс поглощения питательных веществ зависит от биологического класса, к которому они относятся. У человека и животных питание является обычным видом повседневной деятельности.",https://ru.wikipedia.org/wiki/%D0%9F%D0%B8%D1%82%D0%B0%D0%BD%D0%B8%D0%B5,"[['—', 'процесс', 'поглощения', 'пищи', 'живыми', 'организмами'], ['и', 'другие', 'гетеротрофные', 'организмы'], ['является', 'обычным', 'видом']]"
45,ГУМУС,ОРГАНИЧЕСКОЕ ВЕЩЕСТВО,"ОРГАНИЧЕСКОЕ ВЕЩЕСТВО - Вещества, относящиеся к углеводородам или их производным, то есть это класс химических соединений, объединяющий почти все химические соединения, в состав которых входит углерод (за исключением карбидов, угольной кислоты, карбонатов, некоторых оксидов углерода, роданидов, цианидов).",https://ru.wikipedia.org/wiki/%D0%9E%D1%80%D0%B3%D0%B0%D0%BD%D0%B8%D1%87%D0%B5%D1%81%D0%BA%D0%B8%D0%B5_%D0%B2%D0%B5%D1%89%D0%B5%D1%81%D1%82%D0%B2%D0%B0,"[['это', 'класс', 'химических', 'соединении']]"
46,ГУМУС,ПОЧВА,"ПОЧВА - Тонкий верхний слой земной коры, дающий жизнь растениям. Это самостоятельное природное тело, представляющее собой нечто среднее между живым и мертвым веществом. В почве взаимодействуют литосфера, атмосфера, гидросфера и биосфера, а плотность живого вещества планеты максимальна.",http://www.geoglobus.ru/earth/geo8/earth01.php,"[['это', 'самостоятельное', 'природное', 'тело']]"
47,ГУМУС,ОРГАНИЧЕСКАЯ ЧАСТЬ ПОЧВЫ,"ОРГАНИЧЕСКАЯ ЧАСТЬ ПОЧВЫ - Общее понятие, объединяющее все органические вещества, присутствующие в пределах почвенного профиля, в свободном состоянии или в форме органо-минеральных соединений, исключая только вещества, которые входят в состав живых организмов.",https://ru.wikipedia.org/wiki/%D0%9E%D1%80%D0%B3%D0%B0%D0%BD%D0%B8%D1%87%D0%B5%D1%81%D0%BA%D0%B0%D1%8F_%D1%87%D0%B0%D1%81%D1%82%D1%8C_%D0%BF%D0%BE%D1%87%D0%B2%D1%8B,[]
48,ГУМУС,ЧЕРНОЗЕМ,"ЧЕРНОЗЕМ - Богатый гумусом, тёмноокрашенный тип почвы, сформировавшийся на лёссовидных суглинках или глинах в условиях суббореального и умеренно континентального климата при периодически промывном или непромывном водном режиме под многолетней травянистой растительностью.",https://ru.wikipedia.org/wiki/%D0%A7%D0%B5%D1%80%D0%BD%D0%BE%D0%B7%D1%91%D0%BC%D1%8B,[]
49,ГУМУС,ПОЧВЕННЫЙ ГОРИЗОНТ,"ПОЧВЕННЫЙ ГОРИЗОНТ - Специфический слой почвенного профиля, образовавшийся в результате воздействия почвообразовательных процессов и отличающийся от других горизонтов по морфологическим признакам, составу и свойствам.",https://ru.wikipedia.org/wiki/%D0%9F%D0%BE%D1%87%D0%B2%D0%B5%D0%BD%D0%BD%D1%8B%D0%B9_%D0%B3%D0%BE%D1%80%D0%B8%D0%B7%D0%BE%D0%BD%D1%82,[]
50,ГУСЛЯР,МУЗЫКАНТ,"МУЗЫКАНТ - Специалист в области музыки или тот, кто занимается игрой на музыкальном инструменте; занимающийся музыкой профессионально или как знаток и любитель. Также, употребляется применительно к профессиям композитора, дирижёра, певца.",https://ru.wikipedia.org/wiki/%D0%9C%D1%83%D0%B7%D1%8B%D0%BA%D0%B0%D0%BD%D1%82,[]
51,ГУСЛЯР,ПЕВЕЦ,"ПЕВЕЦ - Тот, кто поёт, занимается пением; исполнитель вокальной музыки: песен, романсов, арий, хоров и т. п.; музыкант, исполняющий музыку на музыкальном инструменте, которым является его собственный голос. Певец — наиболее распространённая разновидность вокалиста.",https://ru.wikipedia.org/wiki/%D0%9F%D0%B5%D0%B2%D0%B5%D1%86,"[['является', 'его', 'собственныи']]"
52,ГУСЛЯР,ИСПОЛНИТЕЛЬ,"ИСПОЛНИТЕЛЬ - Физическое лицо, творческим трудом которого создано исполнение: артист-исполнитель (актер, певец, музыкант, танцор или другое лицо, которое играет роль, читает, декламирует, поет, играет на музыкальном инструменте или иным образом участвует в исполнении произведения литературы, искусства или народного творчества, в том числе эстрадного, циркового или кукольного номера), а также режиссёр-постановщик спектакля (лицо, осуществившее постановку театрального, циркового, кукольного, эстрадного или иного театрально-зрелищного представления) и дирижер.",https://ru.wikipedia.org/wiki/%D0%98%D1%81%D0%BF%D0%BE%D0%BB%D0%BD%D0%B8%D1%82%D0%B5%D0%BB%D1%8C,[]
53,ГУСЛЯР,АРТИСТ,"АРТИСТ - Профессиональный исполнитель произведений искусства (актер, певец, музыкант и т.п.). // перен. Тот, кто, обладая высоким мастерством в каком-л. деле, виртуозно выполняет свою работу.",http://tolkslovar.ru/a6094.html,[]
54,ГУСЛЯР,ТВОРЕЦ,"ТВОРЕЦ - Человек, который занимается творчеством;",https://ru.wikipedia.org/wiki/%D0%A2%D0%B2%D0%BE%D1%80%D0%B5%D1%86,[]
55,ГУСЫНЯ,ГУСЬ,"ГУСЬ - Род водоплавающих птиц семейства утиных, отряда гусеобразных.",https://ru.wikipedia.org/wiki/%D0%93%D1%83%D1%81%D0%B8,[]
56,ГУСЫНЯ,УТИНЫЕ,"УТИНЫЕ - Широко распространённое и наиболее многочисленное семейство водоплавающих птиц из отряда гусеобразных (Anseriformes), в состав которого включают около 150 современных видов птиц, разбитых на 40—50 родов[2]. Некоторые виды, такие как кряква или серый гусь, с древних времён были одомашнены человеком и разводятся ради мяса, яиц и пуха, другие являются объектом охотничьего промысла.",https://ru.wikipedia.org/wiki/%D0%A3%D1%82%D0%B8%D0%BD%D1%8B%D0%B5,"[['—', '50', 'родов'], ['являются', 'объектом', 'охотничьего', 'промысла']]"
57,ГУСЫНЯ,ГУСЕОБРАЗНЫЕ,"ГУСЕОБРАЗНЫЕ - Отряд новонёбных птиц, в который наряду с такими птицами, как гуси, утки, лебеди, входят и более экзотические семейства (например, паламедеи из Южной Америки). Виды отряда широко распространены и играют большую роль в биосфере умеренных широт Земли. Некоторые виды гусеобразных имеют важное сельскохозяйственное значение.",https://ru.wikipedia.org/wiki/%D0%93%D1%83%D1%81%D0%B5%D0%BE%D0%B1%D1%80%D0%B0%D0%B7%D0%BD%D1%8B%D0%B5,[]
58,ГУСЫНЯ,НОВОНЕБНЫЕ,"НОВОНЕБНЫЕ - Клада птиц, охватывающая более 9000 видов и подавляющее большинство современных птиц, которой придают ранг ниже подкласса, от инфракласса до надотряда. Противопоставлена кладе бескилевых (Paleognathae).",https://ru.wikipedia.org/wiki/%D0%9D%D0%BE%D0%B2%D0%BE%D0%BD%D1%91%D0%B1%D0%BD%D1%8B%D0%B5,[]
59,ГУСЫНЯ,ПТИЦЫ,"ПТИЦЫ - Класс позвоночных, объединяющий животных, которые отличаются от всех прочих животных наличием перьевого покрова. Птицы распространены по всему миру, весьма разнообразны, многочисленны и легко доступны для наблюдения. Эти высокоорганизованные существа чувствительны, восприимчивы, многоцветны, элегантны и обладают интереснейшими повадками. Поскольку птицы хорошо заметны, они могут служить удобным индикатором состояния окружающей среды. Если они процветают, значит, и среда благополучна.",https://dic.academic.ru/dic.nsf/enc_colier/4012/%D0%9F%D0%A2%D0%98%D0%A6%D0%AB,[]
60,ГЮРЗА,ГИГАНТСКИЕ ГАДЮКИ,"ГИГАНТСКИЕ ГАДЮКИ - Род ядовитых змей семейства Гадюковых. Представители рода населяют пустыни, полупустыни и степи Северной Африки, Ближнего и Среднего Востока, а также Кипр и острова Киклады. Имеют репутацию змей с агрессивным характером и могут выделить большое количество яда, поэтому рассматриваются как очень опасные.",https://ru.wikipedia.org/wiki/%D0%93%D0%B8%D0%B3%D0%B0%D0%BD%D1%82%D1%81%D0%BA%D0%B8%D0%B5_%D0%B3%D0%B0%D0%B4%D1%8E%D0%BA%D0%B8,[]
61,ГЮРЗА,ГАДЮКОВЫЕ,"ГАДЮКОВЫЕ - Семейство ядовитых змей, более известных как гадюки. Все гадюковые имеют пару относительно длинных, полых внутри клыков, которые используются для выделения яда из ядовитых желёз, находящихся за верхней челюстью. Каждый из двух клыков расположен в передней части пасти на верхнечелюстной вращающейся взад-вперед кости.",https://ru.wikipedia.org/wiki/%D0%93%D0%B0%D0%B4%D1%8E%D0%BA%D0%BE%D0%B2%D1%8B%D0%B5,[]
62,ГЮРЗА,ЧЕШУЙЧАТЫЕ,"ЧЕШУЙЧАТЫЕ - Один из четырёх отрядов рептилий, включающий змей, ящериц, а также менее известных двуходок или амфисбен. Включает более 10000 видов, наравне с птицами это наиболее многообразная группа позвоночных после лучеперых рыб. Животные этого отряда широко распространены во всех частях света на материках и островах, отсутствуя только в полярных и приполярных регионах. Представители этого отряда выделяются своим кожным покровом, который несёт роговые чешуйки или щитки.",https://ru.wikipedia.org/wiki/%D0%A7%D0%B5%D1%88%D1%83%D0%B9%D1%87%D0%B0%D1%82%D1%8B%D0%B5,[]
63,ГЮРЗА,ПРЕСМЫКАЮЩИЕСЯ,"ПРЕСМЫКАЮЩИЕСЯ - Класс преимущественно наземных позвоночных животных из клады амниот, включающий современных черепах, крокодилов, клювоголовых и чешуйчатых. Кладисты относят к пресмыкающимся и птиц, так как иначе первые получаются парафилетической группой.",https://ru.wikipedia.org/wiki/%D0%9F%D1%80%D0%B5%D1%81%D0%BC%D1%8B%D0%BA%D0%B0%D1%8E%D1%89%D0%B8%D0%B5%D1%81%D1%8F,[]
64,ГЮРЗА,ХОРДОВЫЕ,"ХОРДОВЫЕ - Тип вторичноротых животных, для которых характерно наличие энтодермального осевого скелета в виде хорды, которая у высших форм заменяется позвоночником. По степени развития нервной системы тип хордовых занимает высшее место среди всех животных. В мире известно более 60 000 видов хордовых.",https://ru.wikipedia.org/wiki/%D0%A5%D0%BE%D1%80%D0%B4%D0%BE%D0%B2%D1%8B%D0%B5,[]
65,ДАДАИЗМ,АВАНГАРД,"АВАНГАРД - Обобщающее название течений в мировом, прежде всего в европейском искусстве, возникших на рубеже XIX и XX веков. В 1920-е годы французский дадаизм слился с сюрреализмом, а в Германии — с экспрессионизмом. Некоторые теоретики искусства считают, что из дадаизма берёт своё начало постмодернизм.",https://ru.wikipedia.org/wiki/%D0%90%D0%B2%D0%B0%D0%BD%D0%B3%D0%B0%D1%80%D0%B4_(%D0%B8%D1%81%D0%BA%D1%83%D1%81%D1%81%D1%82%D0%B2%D0%BE),"[['—', 'с', 'экспрессионизмом']]"
66,ДАДАИЗМ,НАПРАВЛЕНИЕ В ИСКУССТВЕ,"НАПРАВЛЕНИЕ В ИСКУССТВЕ - Понятия, обозначающие принципиальную общность художественных явлений на протяжении определенного времени. Направление обычно рассматривается как более широкая категория, охватывающая единство мировосприятия, эстетических взглядов, путей отображения жизни и связанная со своеобразным художественным стилем (напр., классицизм, романтизм, натурализм, символизм, реализм). Такое единство часто охватывает все или многие виды искусства, причем некоторые из них оказываются ведущими (музыка и лирика в романтизме). Под течением обычно понимается более тесная группировка в пределах направления (""философское течение"" в литературе русского романтизма 20-30-х гг. 19 в.). Принадлежность художников к одному направлению или течению не исключает глубоких различий их творческих индивидуальностей.",https://dic.academic.ru/dic.nsf/enc3p/208202,[]
67,ДАДАИЗМ,МОДЕРНИЗМ,"МОДЕРНИЗМ - Общность направлений искусства конца XIX — начала XX века, признаком которых можно считать разрыв с предшествующей художественной традицией, стремление к новому, условность стиля и непрерывное обновление художественных форм[1]. Модернизм был основным направлением в западноевропейской культуре ХХ века, проявив себя в различных видах искусств.",https://ru.wikipedia.org/wiki/%D0%9C%D0%BE%D0%B4%D0%B5%D1%80%D0%BD%D0%B8%D0%B7%D0%BC,"[['—', 'начала']]"
68,ДАДАИЗМ,ИСКУССТВО,"ИСКУССТВО - Осмысление действительности; процесс или итог выражения внутреннего и внешнего (по отношению к творцу) мира в художественном образе. Творчество, направленное таким образом, что оно отражает интересующее не только самого автора, но и других людей. «Общеинтересное в жизни, — писал Чернышевский, — вот содержание искусства».",https://ru.wikipedia.org/wiki/%D0%98%D1%81%D0%BA%D1%83%D1%81%D1%81%D1%82%D0%B2%D0%BE,"[['—', 'писал', 'чернышевскии'], ['—', 'вот', 'содержание', 'искусства']]"
69,ДАДАИЗМ,ТВОРЧЕСТВО,"ТВОРЧЕСТВО - Процесс деятельности, создающий качественно новые материалы и духовные ценности или итог создания объективно нового. Основной критерий, отличающий творчество от изготовления (производства), — уникальность его результата. Результат творчества невозможно прямо вывести из начальных условий. Никто, кроме, возможно, автора, не может получить в точности такой же результат, если создать для него ту же исходную ситуацию. ",https://ru.wikipedia.org/wiki/%D0%A2%D0%B2%D0%BE%D1%80%D1%87%D0%B5%D1%81%D1%82%D0%B2%D0%BE,"[['—', 'уникальность', 'его', 'результата']]"
70,ДАЛЬНОЗОРКОСТЬ,РЕФРАКЦИЯ,"РЕФРАКЦИЯ - Преломляющая способность оптической системы глаза. Рефракция
глаза бывает трех видов: эмметропия (нормальная рефракция глаза), близорукость,
дальнозоркость.",https://www.bsmu.by/downloads/kafedri/k_farm/2016-2/obyava/2.pdf,[]
71,ДАЛЬНОЗОРКОСТЬ,ДЕФЕКТ,"ДЕФЕКТ - Это локальное нарушение
регламентированных физико-
механических, конструктивных и
эстетических свойств объекта.",https://ncontrol.ru/blog/azbuka_kontrolya/defekt,"[['-', 'это', 'локальное', 'нарушение']]"
72,ДАЛЬНОЗОРКОСТЬ,АНОМАЛИЯ,"АНОМАЛИЯ - Отклонение от нормы, от общей закономерности, неправильность.",https://ru.wikipedia.org/wiki/%D0%90%D0%BD%D0%BE%D0%BC%D0%B0%D0%BB%D0%B8%D1%8F,[]
73,ДАЛЬНОЗОРКОСТЬ,ПАТОЛОГИЯ,"ПАТОЛОГИЯ - Раздел медицинской науки, изучающий болезненные процессы и состояния в живом организме. Состоит из патологической анатомии, изучающей изменения в строении органов и тканей, вызванные болезненными процессами, и патологической физиологии, изучающей нарушение функций органов и организма в целом при его заболеваниях.",https://ru.wikipedia.org/wiki/%D0%9F%D0%B0%D1%82%D0%BE%D0%BB%D0%BE%D0%B3%D0%B8%D1%8F,[]
74,ДАЛЬНОЗОРКОСТЬ,ОТКЛОНЕНИЕ,"ОТКЛОНЕНИЕ - Несовпадение, нарушение, отличие.",https://ru.wikipedia.org/wiki/%D0%9E%D1%82%D0%BA%D0%BB%D0%BE%D0%BD%D0%B5%D0%BD%D0%B8%D0%B5,[]
75,ДАЛЬТОНИЗМ,ЦВЕТОВАЯ СЛЕПОТА,"ЦВЕТОВАЯ СЛЕПОТА - Генетическое нарушение, которое вызывается различием между тем, как одна и более светочувствительные клетки сетчатки реагируют на определенные цвета. Эти клетки, так называемые колбочки, воспринимают длину волны лучей и позволяют сетчатке различать цвета. Такое различие чувствительности одной или более колбочек может вызвать у человека цветовую слепоту.",https://www.bausch.ru/o-vashikh-glazakh/zabolevanija-i-narushenija/cvetovaja-slepota/,[]
76,ДАЛЬТОНИЗМ,ЗРЕНИЕ,"ЗРЕНИЕ -  Способность человека воспринимать информацию путём преобразования энергии электромагнитного излучения светового диапазона, осуществляемая зрительной системой.",https://ru.wikipedia.org/wiki/%D0%97%D1%80%D0%B5%D0%BD%D0%B8%D0%B5_%D1%87%D0%B5%D0%BB%D0%BE%D0%B2%D0%B5%D0%BA%D0%B0,[]
77,ДАЛЬТОНИЗМ,ЗРИТЕЛЬНАЯ СИСТЕМА,"ЗРИТЕЛЬНАЯ СИСТЕМА - Бинокулярная (стереоскопическая) оптическая система биологической природы, эволюционно возникшая у животных и способная воспринимать электромагнитное излучение видимого спектра (свет), создавая ощущение положения предметов в пространстве. Зрительная система обеспечивает функцию зрения.",https://ru.wikipedia.org/wiki/%D0%97%D1%80%D0%B8%D1%82%D0%B5%D0%BB%D1%8C%D0%BD%D0%B0%D1%8F_%D1%81%D0%B8%D1%81%D1%82%D0%B5%D0%BC%D0%B0,[]
